sentence,intent,language
Submitting d o p n power bill,electricity_payment,en
Remitting w e s c o electricity payment,electricity_payment,en
Making u p p c l urban bill payment,electricity_payment,en
Finishing uttar pradesh power corporation rural electricity dues,electricity_payment,en
Resolving s b p d c l power bill,electricity_payment,en
Clearing off m p m k v v c l urban electricity charges,electricity_payment,en
Managing n p c l noida power bill payment,electricity_payment,en
Fulfilling uttar pradesh power urban electricity obligation,electricity_payment,en
Finalizing calcutta electric supply corporation power bill,electricity_payment,en
Completing m p p k v v c l urban electricity transaction,electricity_payment,en
Taking care of mizoram power bill settlement,electricity_payment,en
Closing madhya shetra vidyut vitaran power payment,electricity_payment,en
Concluding b s e s rajdhani power electricity bill,electricity_payment,en
Settling m p poorv kshetra vidyut vitaran rural bill online from upi,electricity_payment,en
Upi for Paying thrissur corporation electricity department electricity bill,electricity_payment,en
Upi payment for Clearing s n d l nagpur power bill,electricity_payment,en
Pay from upi to settle t n e b electricity expense,electricity_payment,en
Pay through upi balance for m p poorv kshetra vidyut vitaran bill,electricity_payment,en
Upi payment to Settling tata power renewables power charges,electricity_payment,en
Taking care of m e p d c l electricity bill through upi account,electricity_payment,en
Use upi payment to Submit chattisgarh state power distribution power bill,electricity_payment,en
I need to settle my electricity bill before the due date,electricity_payment,en
I want to make a payment towards my power bill for this month,electricity_payment,en
planning to clear my outstanding electricity bill with the utility company,electricity_payment,en
I have to take care of my power bill as it's overdue,electricity_payment,en
need to budget for my upcoming electricity bill to avoid any late fees,electricity_payment,en
preparing to make a payment towards my electricity usage for the past month,electricity_payment,en
I'm aware of my power bill and will be making a payment shortly,electricity_payment,en
Settle my electricity bill in person at the utility company's office,electricity_payment,en
I need to pay the electricity bill from upi account,electricity_payment,en
Want to settle the power bill using upi balance,electricity_payment,en
It's my responsibility to cover the electricity expenses use my upi account,electricity_payment,en
Using upi I'm going to take care of the power bill,electricity_payment,en
Upi payment pay the electricity bill ,electricity_payment,en
Payment from Upi account to cover the power dues,electricity_payment,en
Use upi account to settle the electricity bill,electricity_payment,en
I want to take care of the power bill,electricity_payment,en
It's my duty to pay the electricity expenses,electricity_payment,en
I'll make sure to cover the power bill,electricity_payment,en
looking to pay my yamuna power limited bill online for convenience,electricity_payment,en
I'm responsible for paying the t p r m g bill for our household,electricity_payment,en
I need to make a payment to cescom for my electricity bill,electricity_payment,en
My intention is to settle my outstanding balance with goa electricity for my electricity usage,electricity_payment,en
Using upi I would like to remit funds to torrent power ahmedabad in order to cover my electricity charges,electricity_payment,en
It's time for me to pay my monthly electricity bill to chamundeshwari electricity from upi balance,electricity_payment,en
I plan to make payment of my electricity bill to a p s p d c l using upi account for the current billing cycle,electricity_payment,en
I want to clear my dues with chattisgarh power for my recent electricity consumption,electricity_payment,en
I'm interested in making a payment to hubli electricity supply company to cover my electricity expenses,electricity_payment,en
I'm looking to settle my pending electricity bill with central odisha distribution,electricity_payment,en
My aim is to pay my electricity usage charges to t p delhi,electricity_payment,en
I'm eager to settle my outstanding amount with chattisgarh state power distribution co limited for my electricity consumption from upi,electricity_payment,en
Need to pay m p madhya shetra vidyut vitaran for electricity bill,electricity_payment,en
Settling outstanding balance with power and electricity department mizoram,electricity_payment,en
Remitting funds to jamshedpur utilities for electricity charges,electricity_payment,en
Paying monthly electricity bill to gulbarga electricity,electricity_payment,en
Reimbursing m p m k v v c l rural for current billing cycle,electricity_payment,en
Use upi for Clearing dues with k d h p c p l for electricity consumption,electricity_payment,en
Making payment to b s e s rajdhani power for electricity expenses,electricity_payment,en
Settling pending electricity bill with p g v c l,electricity_payment,en
Paying electricity charges to tripura electricity,electricity_payment,en
Clearing outstanding amount with government of puducherry electricity department for electricity usage,electricity_payment,en
electricity bill,electricity_payment,en
i want to pay my electricity bill,electricity_payment,en
pay electricity bill,electricity_payment,en
electricity bill,electricity_payment,en
pay for electricity,electricity_payment,en
pay electricity,electricity_payment,en
Paying electricity bill,electricity_payment,en
Settling power bill online,electricity_payment,en
Covering electricity bill,electricity_payment,en
Clearing power bill balance,electricity_payment,en
Handling electricity bill payment,electricity_payment,en
Taking care of power bill,electricity_payment,en
Settling electricity bill dues,electricity_payment,en
Paying power bill online,electricity_payment,en
Clearing electricity bill balance,electricity_payment,en
Handling power bill payment,electricity_payment,en
Pay electricity bill,electricity_payment,en
Pay for electricity,electricity_payment,en
Make payment for electricity,electricity_payment,en
payment for electricity bill,electricity_payment,en
Electricity bill payment,electricity_payment,en
Check electricity bill,electricity_payment,en
Check electricity dues,electricity_payment,en
Paying electricity bill through upi,electricity_payment,en
Settling power bill using upi,electricity_payment,en
Covering electricity dues from upi balance,electricity_payment,en
Clearing power bill balance fthrough upi account,electricity_payment,en
Upi pay to Handle electricity bill payment,electricity_payment,en
Paying from upi to pay power bill,electricity_payment,en
Make payment from upi for electricity bill,electricity_payment,en
Upi payment for power bill online,electricity_payment,en
Paying electricity bill through UPI,electricity_payment,en
Using UPI for settling power bill online,electricity_payment,en
Use UPI to pay electricity bill today,electricity_payment,en
Clearing power bill balance. Make payment through upi account,electricity_payment,en
Handling electricity bill payment,electricity_payment,en
Taking care of power bill. Pay from upi account,electricity_payment,en
Settling electricity bill dues,electricity_payment,en
Paying power bill online,electricity_payment,en
Clearing electricity bill balance,electricity_payment,en
Handling power bill payment,electricity_payment,en
Pay electricity bill,electricity_payment,en
Pay for electricity,electricity_payment,en
Make payment for electricity,electricity_payment,en
payment for electricity bill,electricity_payment,en
Electricity bill payment,electricity_payment,en
Settling m p poorv shetra vidyut vitaran bill online,electricity_payment,en
Paying hubli electricity electricity bill,electricity_payment,en
Clearing paschim shetra vidyut vitaran power bill,electricity_payment,en
Covering puducherry electricity department electricity expense,electricity_payment,en
Handling n p c l noida power bill payment,electricity_payment,en
Settling kerala electricity board power charges,electricity_payment,en
Taking care of mescom electricity bill,electricity_payment,en
Submitting jharkhand bijli vitran nigam power bill,electricity_payment,en
Remitting jamshedpur utilities electricity payment,electricity_payment,en
Making sikkim power rural bill payment,electricity_payment,en
Finishing m e p d c l electricity dues,electricity_payment,en
Resolving nagaland power power bill,electricity_payment,en
Clearing off uttar pradesh power corporation rural electricity charges,electricity_payment,en
Managing jamshedpur utilities bill payment,electricity_payment,en
Fulfilling m p paschim kshetra vidyut vitaran electricity obligation,electricity_payment,en
Finalizing h p s e b power bill,electricity_payment,en
Completing meghalaya power distribution corporation electricity transaction,electricity_payment,en
Taking care of jodhpur vidyut vitran nigam bill settlement,electricity_payment,en
Closing uttar haryana bijli vitran nigam power payment,electricity_payment,en
Concluding puducherry electricity department electricity bill,electricity_payment,en
Settling b s e s rajdhani power bill online from upi,electricity_payment,en
Upi for Paying j k p d d electricity bill,electricity_payment,en
Upi payment for Clearing m p m k v v c l rural power bill,electricity_payment,en
Pay from upi to settle department of power government of arunachal pradesh electricity expense,electricity_payment,en
Pay through upi balance for t p r m g bill,electricity_payment,en
Upi payment to Settling jammu and kashmir power development department power charges,electricity_payment,en
Taking care of d o p n electricity bill through upi account,electricity_payment,en
Use upi payment to Submit torrent power surat power bill,electricity_payment,en
I need to settle my electricity bill before the due date,electricity_payment,en
I want to make a payment towards my power bill for this month,electricity_payment,en
planning to clear my outstanding electricity bill with the utility company,electricity_payment,en
I have to take care of my power bill as it's overdue,electricity_payment,en
need to budget for my upcoming electricity bill to avoid any late fees,electricity_payment,en
preparing to make a payment towards my electricity usage for the past month,electricity_payment,en
I'm aware of my power bill and will be making a payment shortly,electricity_payment,en
Settle my electricity bill in person at the utility company's office,electricity_payment,en
I need to pay the electricity bill from upi account,electricity_payment,en
Want to settle the power bill using upi balance,electricity_payment,en
It's my responsibility to cover the electricity expenses use my upi account,electricity_payment,en
Using upi I'm going to take care of the power bill,electricity_payment,en
Upi payment pay the electricity bill ,electricity_payment,en
Payment from Upi account to cover the power dues,electricity_payment,en
Use upi account to settle the electricity bill,electricity_payment,en
I want to take care of the power bill,electricity_payment,en
It's my duty to pay the electricity expenses,electricity_payment,en
I'll make sure to cover the power bill,electricity_payment,en
looking to pay my c e s u bill online for convenience,electricity_payment,en
I'm responsible for paying the t p r m g bill for our household,electricity_payment,en
I need to make a payment to k e d l for my electricity bill,electricity_payment,en
My intention is to settle my outstanding balance with power and electricity department mizoram for my electricity usage,electricity_payment,en
Using upi I would like to remit funds to jusco in order to cover my electricity charges,electricity_payment,en
It's time for me to pay my monthly electricity bill to torrent power agra from upi balance,electricity_payment,en
I plan to make payment of my electricity bill to jaipur vidyut vitran nigam using upi account for the current billing cycle,electricity_payment,en
I want to clear my dues with madhya shetra vidyut rural for my recent electricity consumption,electricity_payment,en
I'm interested in making a payment to b s e s yamuna power limited to cover my electricity expenses,electricity_payment,en
I'm looking to settle my pending electricity bill with bharatpur electricity services,electricity_payment,en
My aim is to pay my electricity usage charges to lakshadweep electricity,electricity_payment,en
I'm eager to settle my outstanding amount with central odisha distribution for my electricity consumption from upi,electricity_payment,en
Need to pay tata power odisha for electricity bill,electricity_payment,en
Settling outstanding balance with department of power government of arunachal pradesh,electricity_payment,en
Remitting funds to u p c l for electricity charges,electricity_payment,en
Paying monthly electricity bill to kanpur electricity,electricity_payment,en
Reimbursing chattisgarh state power distribution co limited for current billing cycle,electricity_payment,en
Use upi for Clearing dues with chattisgarh state power distribution for electricity consumption,electricity_payment,en
Making payment to c e s c for electricity expenses,electricity_payment,en
Settling pending electricity bill with madhya shetra vidyut rural,electricity_payment,en
Paying electricity charges to jaipur vidyut vitran nigam,electricity_payment,en
Clearing outstanding amount with west bengal electricity company for electricity usage,electricity_payment,en
electricity bill,electricity_payment,en
i want to pay my electricity bill,electricity_payment,en
pay electricity bill,electricity_payment,en
electricity bill,electricity_payment,en
pay for electricity,electricity_payment,en
pay electricity,electricity_payment,en
Paying electricity bill,electricity_payment,en
Settling power bill online,electricity_payment,en
Covering electricity bill,electricity_payment,en
Clearing power bill balance,electricity_payment,en
Handling electricity bill payment,electricity_payment,en
Taking care of power bill,electricity_payment,en
Settling electricity bill dues,electricity_payment,en
Paying power bill online,electricity_payment,en
Clearing electricity bill balance,electricity_payment,en
Handling power bill payment,electricity_payment,en
Pay electricity bill,electricity_payment,en
Pay for electricity,electricity_payment,en
Make payment for electricity,electricity_payment,en
payment for electricity bill,electricity_payment,en
Electricity bill payment,electricity_payment,en
Check electricity bill,electricity_payment,en
Check electricity dues,electricity_payment,en
Paying electricity bill through upi,electricity_payment,en
Settling power bill using upi,electricity_payment,en
Covering electricity dues from upi balance,electricity_payment,en
Clearing power bill balance fthrough upi account,electricity_payment,en
Upi pay to Handle electricity bill payment,electricity_payment,en
Paying from upi to pay power bill,electricity_payment,en
Make payment from upi for electricity bill,electricity_payment,en
Upi payment for power bill online,electricity_payment,en
Paying electricity bill through UPI,electricity_payment,en
Using UPI for settling power bill online,electricity_payment,en
Use UPI to pay electricity bill today,electricity_payment,en
Clearing power bill balance. Make payment through upi account,electricity_payment,en
Handling electricity bill payment,electricity_payment,en
Taking care of power bill. Pay from upi account,electricity_payment,en
Settling electricity bill dues,electricity_payment,en
Paying power bill online,electricity_payment,en
Clearing electricity bill balance,electricity_payment,en
Handling power bill payment,electricity_payment,en
Pay electricity bill,electricity_payment,en
Pay for electricity,electricity_payment,en
Make payment for electricity,electricity_payment,en
payment for electricity bill,electricity_payment,en
Electricity bill payment,electricity_payment,en
Settling mangalore electricity supply company bill online,electricity_payment,en
Paying west bengal electricity company electricity bill,electricity_payment,en
Clearing m p p k v v c l power bill,electricity_payment,en
Covering p y e b electricity expense,electricity_payment,en
Handling j v v n l bill payment,electricity_payment,en
Settling yamuna power limited power charges,electricity_payment,en
Taking care of m g v c l electricity bill,electricity_payment,en
Submitting torrent power ahmedabad power bill,electricity_payment,en
Remitting chattisgarh state power distribution electricity payment,electricity_payment,en
Making madhya gujarat vij company bill payment,electricity_payment,en
Finishing southern power distribution company electricity dues,electricity_payment,en
Resolving ajmer vidyut vitran nigam power bill,electricity_payment,en
Clearing off madhya gujarat vij company electricity charges,electricity_payment,en
Managing t c e d bill payment,electricity_payment,en
Fulfilling hubli electricity electricity obligation,electricity_payment,en
Finalizing d d e d power bill,electricity_payment,en
Completing jammu and kashmir power development department electricity transaction,electricity_payment,en
Taking care of u p p c l rural bill settlement,electricity_payment,en
Closing thrissur corporation electricity department power payment,electricity_payment,en
Concluding torrent power electricity bill,electricity_payment,en
Settling central odisha distribution bill online from upi,electricity_payment,en
Upi for Paying west bengal state electricity distribution company electricity bill,electricity_payment,en
Upi payment for Clearing u p p c l urban power bill,electricity_payment,en
Pay from upi to settle m p vidyut rural electricity expense,electricity_payment,en
Pay through upi balance for bangalore electricity bill,electricity_payment,en
Upi payment to Settling m p madhya kshetra vidyut vitaran rural power charges,electricity_payment,en
Taking care of punjab state power corporation electricity bill through upi account,electricity_payment,en
Use upi payment to Submit s k m p w r urban power bill,electricity_payment,en
I need to settle my electricity bill before the due date,electricity_payment,en
I want to make a payment towards my power bill for this month,electricity_payment,en
planning to clear my outstanding electricity bill with the utility company,electricity_payment,en
I have to take care of my power bill as it's overdue,electricity_payment,en
need to budget for my upcoming electricity bill to avoid any late fees,electricity_payment,en
preparing to make a payment towards my electricity usage for the past month,electricity_payment,en
I'm aware of my power bill and will be making a payment shortly,electricity_payment,en
Settle my electricity bill in person at the utility company's office,electricity_payment,en
I need to pay the electricity bill from upi account,electricity_payment,en
Want to settle the power bill using upi balance,electricity_payment,en
It's my responsibility to cover the electricity expenses use my upi account,electricity_payment,en
Using upi I'm going to take care of the power bill,electricity_payment,en
Upi payment pay the electricity bill ,electricity_payment,en
Payment from Upi account to cover the power dues,electricity_payment,en
Use upi account to settle the electricity bill,electricity_payment,en
I want to take care of the power bill,electricity_payment,en
It's my duty to pay the electricity expenses,electricity_payment,en
I'll make sure to cover the power bill,electricity_payment,en
looking to pay my arunachal power bill online for convenience,electricity_payment,en
I'm responsible for paying the mangalore electricity supply company bill for our household,electricity_payment,en
I need to make a payment to torrent power bhiwandi for my electricity bill,electricity_payment,en
My intention is to settle my outstanding balance with assam power distribution company limited for my electricity usage,electricity_payment,en
Using upi I would like to remit funds to uttar pradesh power urban in order to cover my electricity charges,electricity_payment,en
It's time for me to pay my monthly electricity bill to p e d m from upi balance,electricity_payment,en
I plan to make payment of my electricity bill to uttar pradesh power corporation urban using upi account for the current billing cycle,electricity_payment,en
I want to clear my dues with paschim gujarat vij company for my recent electricity consumption,electricity_payment,en
I'm interested in making a payment to u p p c l urban to cover my electricity expenses,electricity_payment,en
I'm looking to settle my pending electricity bill with bharatpur electricity,electricity_payment,en
My aim is to pay my electricity usage charges to puducherry electricity department,electricity_payment,en
I'm eager to settle my outstanding amount with j k p d d for my electricity consumption from upi,electricity_payment,en
Need to pay m p madhyashetra vidyut rural for electricity bill,electricity_payment,en
Settling outstanding balance with jodhpur vidyut vitran nigam,electricity_payment,en
Remitting funds to m p m k v v c l urban for electricity charges,electricity_payment,en
Paying monthly electricity bill to eastern power distribution company,electricity_payment,en
Reimbursing j v v n l for current billing cycle,electricity_payment,en
Use upi for Clearing dues with j v v n l for electricity consumption,electricity_payment,en
Making payment to chattisgarh state power distribution co limited for electricity expenses,electricity_payment,en
Settling pending electricity bill with d h b v n,electricity_payment,en
Paying electricity charges to c e s u,electricity_payment,en
Clearing outstanding amount with mangalore electricity for electricity usage,electricity_payment,en
electricity bill,electricity_payment,en
i want to pay my electricity bill,electricity_payment,en
pay electricity bill,electricity_payment,en
electricity bill,electricity_payment,en
pay for electricity,electricity_payment,en
pay electricity,electricity_payment,en
Paying electricity bill,electricity_payment,en
Settling power bill online,electricity_payment,en
Covering electricity bill,electricity_payment,en
Clearing power bill balance,electricity_payment,en
Handling electricity bill payment,electricity_payment,en
Taking care of power bill,electricity_payment,en
Settling electricity bill dues,electricity_payment,en
Paying power bill online,electricity_payment,en
Clearing electricity bill balance,electricity_payment,en
Handling power bill payment,electricity_payment,en
Pay electricity bill,electricity_payment,en
Pay for electricity,electricity_payment,en
Make payment for electricity,electricity_payment,en
payment for electricity bill,electricity_payment,en
Electricity bill payment,electricity_payment,en
Check electricity bill,electricity_payment,en
Check electricity dues,electricity_payment,en
Paying electricity bill through upi,electricity_payment,en
Settling power bill using upi,electricity_payment,en
Covering electricity dues from upi balance,electricity_payment,en
Clearing power bill balance fthrough upi account,electricity_payment,en
Upi pay to Handle electricity bill payment,electricity_payment,en
Paying from upi to pay power bill,electricity_payment,en
Make payment from upi for electricity bill,electricity_payment,en
Upi payment for power bill online,electricity_payment,en
Paying electricity bill through UPI,electricity_payment,en
Using UPI for settling power bill online,electricity_payment,en
Use UPI to pay electricity bill today,electricity_payment,en
Clearing power bill balance. Make payment through upi account,electricity_payment,en
Handling electricity bill payment,electricity_payment,en
Taking care of power bill. Pay from upi account,electricity_payment,en
Settling electricity bill dues,electricity_payment,en
Paying power bill online,electricity_payment,en
Clearing electricity bill balance,electricity_payment,en
Handling power bill payment,electricity_payment,en
Pay electricity bill,electricity_payment,en
Pay for electricity,electricity_payment,en
Make payment for electricity,electricity_payment,en
payment for electricity bill,electricity_payment,en
Electricity bill payment,electricity_payment,en
Settling t n e b bill online,electricity_payment,en
Paying madhya shetra vidyut vitran rural electricity bill,electricity_payment,en
Clearing d n h power distribution company limited power bill,electricity_payment,en
Covering b e s t mumbai electricity expense,electricity_payment,en
Handling c e s u bill payment,electricity_payment,en
Settling s k m p w r urban power charges,electricity_payment,en
Taking care of madhya gujarat vij company electricity bill,electricity_payment,en
Submitting j b v n l power bill,electricity_payment,en
Remitting hubli electricity supply company electricity payment,electricity_payment,en
Making gift power bill payment,electricity_payment,en
Finishing chamundeshwari electricity electricity dues,electricity_payment,en
Resolving power and electricity department mizoram power bill,electricity_payment,en
Clearing off himachal pradesh electricity board electricity charges,electricity_payment,en
Managing dakshin haryana bijli vitran nigam bill payment,electricity_payment,en
Fulfilling tata power renewables electricity obligation,electricity_payment,en
Finalizing p g v c l power bill,electricity_payment,en
Completing west bengal electricity company electricity transaction,electricity_payment,en
Taking care of t n e b bill settlement,electricity_payment,en
Closing m p p k v v c l rural power payment,electricity_payment,en
Concluding uttarakhand power electricity bill,electricity_payment,en
Settling m p vidyut urban bill online from upi,electricity_payment,en
Upi for Paying sikkim power rural electricity bill,electricity_payment,en
Upi payment for Clearing m p p k v v c l power bill,electricity_payment,en
