sentence,intent,language
Using upi I would like to remit funds to dakshin gujarat vij company limited in order to cover my electricity charges,electricity_payment,en
It's time for me to pay my monthly electricity bill to thrissur electricity department from upi balance,electricity_payment,en
I plan to make payment of my electricity bill to new delhi municipal council electricity using upi account for the current billing cycle,electricity_payment,en
I want to clear my dues with bikaner electricity for my recent electricity consumption,electricity_payment,en
I'm interested in making a payment to g e d to cover my electricity expenses,electricity_payment,en
I'm looking to settle my pending electricity bill with himachal pradesh electricity board,electricity_payment,en
My aim is to pay my electricity usage charges to t p renewables microgrid,electricity_payment,en
I'm eager to settle my outstanding amount with n b p d c l for my electricity consumption from upi,electricity_payment,en
Need to pay t p renewables microgrid for electricity bill,electricity_payment,en
Settling outstanding balance with m p paschim kshetra vidyut vitaran,electricity_payment,en
Remitting funds to c e s c for electricity charges,electricity_payment,en
Paying monthly electricity bill to t p r m g,electricity_payment,en
Reimbursing madhya gujarat vij company for current billing cycle,electricity_payment,en
Use upi for Clearing dues with kota electricity distribution limited for electricity consumption,electricity_payment,en
Making payment to asam power company for electricity expenses,electricity_payment,en
Settling pending electricity bill with j v v n l,electricity_payment,en
Paying electricity charges to power and electricity department mizoram,electricity_payment,en
Clearing outstanding amount with uttar pradesh power urban for electricity usage,electricity_payment,en
electricity bill,electricity_payment,en
i want to pay my electricity bill,electricity_payment,en
pay electricity bill,electricity_payment,en
electricity bill,electricity_payment,en
pay for electricity,electricity_payment,en
pay electricity,electricity_payment,en
Paying electricity bill,electricity_payment,en
Settling power bill online,electricity_payment,en
Covering electricity bill,electricity_payment,en
Clearing power bill balance,electricity_payment,en
Handling electricity bill payment,electricity_payment,en
Taking care of power bill,electricity_payment,en
Settling electricity bill dues,electricity_payment,en
Paying power bill online,electricity_payment,en
Clearing electricity bill balance,electricity_payment,en
Handling power bill payment,electricity_payment,en
Pay electricity bill,electricity_payment,en
Pay for electricity,electricity_payment,en
Make payment for electricity,electricity_payment,en
payment for electricity bill,electricity_payment,en
Electricity bill payment,electricity_payment,en
Check electricity bill,electricity_payment,en
Check electricity dues,electricity_payment,en
Paying electricity bill through upi,electricity_payment,en
Settling power bill using upi,electricity_payment,en
Covering electricity dues from upi balance,electricity_payment,en
Clearing power bill balance fthrough upi account,electricity_payment,en
Upi pay to Handle electricity bill payment,electricity_payment,en
Paying from upi to pay power bill,electricity_payment,en
Make payment from upi for electricity bill,electricity_payment,en
Upi payment for power bill online,electricity_payment,en
Paying electricity bill through UPI,electricity_payment,en
Using UPI for settling power bill online,electricity_payment,en
Use UPI to pay electricity bill today,electricity_payment,en
Clearing power bill balance. Make payment through upi account,electricity_payment,en
Handling electricity bill payment,electricity_payment,en
Taking care of power bill. Pay from upi account,electricity_payment,en
Settling electricity bill dues,electricity_payment,en
Paying power bill online,electricity_payment,en
Clearing electricity bill balance,electricity_payment,en
Handling power bill payment,electricity_payment,en
Pay electricity bill,electricity_payment,en
Pay for electricity,electricity_payment,en
Make payment for electricity,electricity_payment,en
payment for electricity bill,electricity_payment,en
Electricity bill payment,electricity_payment,en
Settling chamundeshwari electricity bill online,electricity_payment,en
Paying gulbarga electricity electricity bill,electricity_payment,en
Clearing himachal pradesh electricity board power bill,electricity_payment,en
Covering a p d c l electricity expense,electricity_payment,en
Handling j v v n l bill payment,electricity_payment,en
Settling tripura electricity corporation power charges,electricity_payment,en
Taking care of west bengal electricity company electricity bill,electricity_payment,en
Submitting m p paschim kshetra vidyut vitaran power bill,electricity_payment,en
Remitting h p s e b electricity payment,electricity_payment,en
Making jamshedpur utilities bill payment,electricity_payment,en
Finishing goa electricity electricity dues,electricity_payment,en
Resolving calcutta electric supply corporation power bill,electricity_payment,en
Clearing off m p madhyashetra vidyut rural electricity charges,electricity_payment,en
Managing m p poorv shetra vidyut vitaran bill payment,electricity_payment,en
Fulfilling chattisgarh state power distribution co limited electricity obligation,electricity_payment,en
Finalizing a p d c l power bill,electricity_payment,en
Completing d h b v n electricity transaction,electricity_payment,en
Taking care of h p s e b bill settlement,electricity_payment,en
Closing d h b v n power payment,electricity_payment,en
Concluding w e s c o electricity bill,electricity_payment,en
Settling m p madhya kshetra vidyut vitaran urban bill online from upi,electricity_payment,en
Upi for Paying t p renewables microgrid electricity bill,electricity_payment,en
Upi payment for Clearing j k p d d power bill,electricity_payment,en
Pay from upi to settle w e s c o electricity expense,electricity_payment,en
Pay through upi balance for south bihar power distribution company bill,electricity_payment,en
Upi payment to Settling uttar pradesh power corporation rural power charges,electricity_payment,en
Taking care of uttar haryana bijli nigam electricity bill through upi account,electricity_payment,en
Use upi payment to Submit b e s l power bill,electricity_payment,en
I need to settle my electricity bill before the due date,electricity_payment,en
I want to make a payment towards my power bill for this month,electricity_payment,en
planning to clear my outstanding electricity bill with the utility company,electricity_payment,en
I have to take care of my power bill as it's overdue,electricity_payment,en
need to budget for my upcoming electricity bill to avoid any late fees,electricity_payment,en
preparing to make a payment towards my electricity usage for the past month,electricity_payment,en
I'm aware of my power bill and will be making a payment shortly,electricity_payment,en
Settle my electricity bill in person at the utility company's office,electricity_payment,en
I need to pay the electricity bill from upi account,electricity_payment,en
Want to settle the power bill using upi balance,electricity_payment,en
It's my responsibility to cover the electricity expenses use my upi account,electricity_payment,en
Using upi I'm going to take care of the power bill,electricity_payment,en
Upi payment pay the electricity bill ,electricity_payment,en
Payment from Upi account to cover the power dues,electricity_payment,en
Use upi account to settle the electricity bill,electricity_payment,en
I want to take care of the power bill,electricity_payment,en
It's my duty to pay the electricity expenses,electricity_payment,en
I'll make sure to cover the power bill,electricity_payment,en
looking to pay my lakshadweep electricity department bill online for convenience,electricity_payment,en
I'm responsible for paying the kanpur electricity supply company bill for our household,electricity_payment,en
I need to make a payment to m p madhya shetra vidyut vitaran for my electricity bill,electricity_payment,en
My intention is to settle my outstanding balance with m p m k v v c l rural for my electricity usage,electricity_payment,en
Using upi I would like to remit funds to u p p c l urban in order to cover my electricity charges,electricity_payment,en
It's time for me to pay my monthly electricity bill to m g v c l from upi balance,electricity_payment,en
I plan to make payment of my electricity bill to torrent power ahmedabad using upi account for the current billing cycle,electricity_payment,en
I want to clear my dues with uttar pradesh power corporation rural for my recent electricity consumption,electricity_payment,en
I'm interested in making a payment to hubli electricity supply company to cover my electricity expenses,electricity_payment,en
I'm looking to settle my pending electricity bill with central odisha distribution,electricity_payment,en
My aim is to pay my electricity usage charges to kerala electricity board,electricity_payment,en
I'm eager to settle my outstanding amount with jharkhand bijli vitran nigam for my electricity consumption from upi,electricity_payment,en
Need to pay kesco for electricity bill,electricity_payment,en
Settling outstanding balance with m p p k v v c l rural,electricity_payment,en
Remitting funds to bharatpur electricity for electricity charges,electricity_payment,en
Paying monthly electricity bill to puducherry electricity department,electricity_payment,en
Reimbursing n e s c o for current billing cycle,electricity_payment,en
Use upi for Clearing dues with arunachal power for electricity consumption,electricity_payment,en
Making payment to nesco for electricity expenses,electricity_payment,en
Settling pending electricity bill with a p d c l,electricity_payment,en
Paying electricity charges to bescom,electricity_payment,en
Clearing outstanding amount with jaipur vidyut vitran nigam for electricity usage,electricity_payment,en
electricity bill,electricity_payment,en
i want to pay my electricity bill,electricity_payment,en
pay electricity bill,electricity_payment,en
electricity bill,electricity_payment,en
pay for electricity,electricity_payment,en
pay electricity,electricity_payment,en
Paying electricity bill,electricity_payment,en
Settling power bill online,electricity_payment,en
Covering electricity bill,electricity_payment,en
Clearing power bill balance,electricity_payment,en
Handling electricity bill payment,electricity_payment,en
Taking care of power bill,electricity_payment,en
Settling electricity bill dues,electricity_payment,en
Paying power bill online,electricity_payment,en
Clearing electricity bill balance,electricity_payment,en
Handling power bill payment,electricity_payment,en
Pay electricity bill,electricity_payment,en
Pay for electricity,electricity_payment,en
Make payment for electricity,electricity_payment,en
payment for electricity bill,electricity_payment,en
Electricity bill payment,electricity_payment,en
Check electricity bill,electricity_payment,en
Check electricity dues,electricity_payment,en
Paying electricity bill through upi,electricity_payment,en
Settling power bill using upi,electricity_payment,en
Covering electricity dues from upi balance,electricity_payment,en
Clearing power bill balance fthrough upi account,electricity_payment,en
Upi pay to Handle electricity bill payment,electricity_payment,en
Paying from upi to pay power bill,electricity_payment,en
Make payment from upi for electricity bill,electricity_payment,en
Upi payment for power bill online,electricity_payment,en
Paying electricity bill through UPI,electricity_payment,en
Using UPI for settling power bill online,electricity_payment,en
Use UPI to pay electricity bill today,electricity_payment,en
Clearing power bill balance. Make payment through upi account,electricity_payment,en
Handling electricity bill payment,electricity_payment,en
Taking care of power bill. Pay from upi account,electricity_payment,en
Settling electricity bill dues,electricity_payment,en
Paying power bill online,electricity_payment,en
Clearing electricity bill balance,electricity_payment,en
Handling power bill payment,electricity_payment,en
Pay electricity bill,electricity_payment,en
Pay for electricity,electricity_payment,en
Make payment for electricity,electricity_payment,en
payment for electricity bill,electricity_payment,en
Electricity bill payment,electricity_payment,en
Settling jusco bill online,electricity_payment,en
Paying tamil nadu electricity board electricity bill,electricity_payment,en
Clearing southern power company power bill,electricity_payment,en
Covering best electricity expense,electricity_payment,en
Handling m p p k v v c l bill payment,electricity_payment,en
Settling department of power nagaland power charges,electricity_payment,en
Taking care of tata power ajmer electricity bill,electricity_payment,en
Submitting south bihar power distribution company power bill,electricity_payment,en
Remitting m e p d c l electricity payment,electricity_payment,en
Making dakshin gujarat vij company bill payment,electricity_payment,en
Finishing southern power company electricity dues,electricity_payment,en
Resolving bharatpur electricity services power bill,electricity_payment,en
Clearing off hubli electricity supply company electricity charges,electricity_payment,en
Managing kanpur electricity supply company bill payment,electricity_payment,en
Fulfilling b s e s yamuna power limited electricity obligation,electricity_payment,en
Finalizing u p p c l urban power bill,electricity_payment,en
Completing uttar gujarat vij company electricity transaction,electricity_payment,en
Taking care of d n h p d c l bill settlement,electricity_payment,en
Closing ajmer vidyut vitran nigam power payment,electricity_payment,en
Concluding bikaner electricity supply electricity bill,electricity_payment,en
Settling t p a d l bill online from upi,electricity_payment,en
Upi for Paying hubli electricity supply company electricity bill,electricity_payment,en
Upi payment for Clearing n b p d c l power bill,electricity_payment,en
Pay from upi to settle k e d l electricity expense,electricity_payment,en
Pay through upi balance for jodhpur vidyut vitran nigam bill,electricity_payment,en
Upi payment to Settling u p p c l urban power charges,electricity_payment,en
Taking care of k e d l electricity bill through upi account,electricity_payment,en
Use upi payment to Submit government of puducherry electricity department power bill,electricity_payment,en
I need to settle my electricity bill before the due date,electricity_payment,en
I want to make a payment towards my power bill for this month,electricity_payment,en
planning to clear my outstanding electricity bill with the utility company,electricity_payment,en
I have to take care of my power bill as it's overdue,electricity_payment,en
need to budget for my upcoming electricity bill to avoid any late fees,electricity_payment,en
preparing to make a payment towards my electricity usage for the past month,electricity_payment,en
I'm aware of my power bill and will be making a payment shortly,electricity_payment,en
Settle my electricity bill in person at the utility company's office,electricity_payment,en
I need to pay the electricity bill from upi account,electricity_payment,en
Want to settle the power bill using upi balance,electricity_payment,en
It's my responsibility to cover the electricity expenses use my upi account,electricity_payment,en
Using upi I'm going to take care of the power bill,electricity_payment,en
Upi payment pay the electricity bill ,electricity_payment,en
Payment from Upi account to cover the power dues,electricity_payment,en
Use upi account to settle the electricity bill,electricity_payment,en
I want to take care of the power bill,electricity_payment,en
It's my duty to pay the electricity expenses,electricity_payment,en
I'll make sure to cover the power bill,electricity_payment,en
looking to pay my s b p d c l bill online for convenience,electricity_payment,en
I'm responsible for paying the uttar gujarat vij company bill for our household,electricity_payment,en
I need to make a payment to southern power distribution company for my electricity bill,electricity_payment,en
My intention is to settle my outstanding balance with west bengal electricity company for my electricity usage,electricity_payment,en
Using upi I would like to remit funds to torrent power surat in order to cover my electricity charges,electricity_payment,en
It's time for me to pay my monthly electricity bill to tata power western odisha from upi balance,electricity_payment,en
I plan to make payment of my electricity bill to bangalore electricity supply using upi account for the current billing cycle,electricity_payment,en
I want to clear my dues with power and electricity department mizoram for my recent electricity consumption,electricity_payment,en
I'm interested in making a payment to madhya gujarat vij company to cover my electricity expenses,electricity_payment,en
I'm looking to settle my pending electricity bill with punjab state power,electricity_payment,en
My aim is to pay my electricity usage charges to jusco,electricity_payment,en
I'm eager to settle my outstanding amount with bharatpur electricity services for my electricity consumption from upi,electricity_payment,en
Need to pay west bengal electricity for electricity bill,electricity_payment,en
Settling outstanding balance with puducherry electricity department,electricity_payment,en
Remitting funds to asam power company for electricity charges,electricity_payment,en
Paying monthly electricity bill to s k m p w r rural,electricity_payment,en
Reimbursing t p southern odisha distribution for current billing cycle,electricity_payment,en
Use upi for Clearing dues with gulbarga electricity supply company for electricity consumption,electricity_payment,en
Making payment to gulbarga electricity supply company for electricity expenses,electricity_payment,en
Settling pending electricity bill with a p d c l,electricity_payment,en
Paying electricity charges to lakshadweep electricity department,electricity_payment,en
Clearing outstanding amount with torrent power ahmedabad for electricity usage,electricity_payment,en
electricity bill,electricity_payment,en
i want to pay my electricity bill,electricity_payment,en
pay electricity bill,electricity_payment,en
electricity bill,electricity_payment,en
pay for electricity,electricity_payment,en
pay electricity,electricity_payment,en
Paying electricity bill,electricity_payment,en
Settling power bill online,electricity_payment,en
Covering electricity bill,electricity_payment,en
Clearing power bill balance,electricity_payment,en
Handling electricity bill payment,electricity_payment,en
Taking care of power bill,electricity_payment,en
Settling electricity bill dues,electricity_payment,en
Paying power bill online,electricity_payment,en
Clearing electricity bill balance,electricity_payment,en
Handling power bill payment,electricity_payment,en
Pay electricity bill,electricity_payment,en
Pay for electricity,electricity_payment,en
Make payment for electricity,electricity_payment,en
payment for electricity bill,electricity_payment,en
Electricity bill payment,electricity_payment,en
Check electricity bill,electricity_payment,en
Check electricity dues,electricity_payment,en
Paying electricity bill through upi,electricity_payment,en
Settling power bill using upi,electricity_payment,en
Covering electricity dues from upi balance,electricity_payment,en
Clearing power bill balance fthrough upi account,electricity_payment,en
Upi pay to Handle electricity bill payment,electricity_payment,en
Paying from upi to pay power bill,electricity_payment,en
Make payment from upi for electricity bill,electricity_payment,en
Upi payment for power bill online,electricity_payment,en
Paying electricity bill through UPI,electricity_payment,en
Using UPI for settling power bill online,electricity_payment,en
Use UPI to pay electricity bill today,electricity_payment,en
Clearing power bill balance. Make payment through upi account,electricity_payment,en
Handling electricity bill payment,electricity_payment,en
Taking care of power bill. Pay from upi account,electricity_payment,en
Settling electricity bill dues,electricity_payment,en
Paying power bill online,electricity_payment,en
Clearing electricity bill balance,electricity_payment,en
Handling power bill payment,electricity_payment,en
Pay electricity bill,electricity_payment,en
Pay for electricity,electricity_payment,en
Make payment for electricity,electricity_payment,en
payment for electricity bill,electricity_payment,en
Electricity bill payment,electricity_payment,en
Settling tata power ajmer bill online,electricity_payment,en
Paying bangalore electricity supply electricity bill,electricity_payment,en
Clearing tripura electricity corporation power bill,electricity_payment,en
Covering mizoram power electricity expense,electricity_payment,en
Handling kannan devan hills plantations company private limited bill payment,electricity_payment,en
Settling bikaner electricity power charges,electricity_payment,en
Taking care of t p central odisha distribution electricity bill,electricity_payment,en
Submitting hubli electricity supply company power bill,electricity_payment,en
Remitting gulbarga electricity supply company electricity payment,electricity_payment,en
Making sikkim power urban bill payment,electricity_payment,en
Finishing m e p d c l electricity dues,electricity_payment,en
Resolving goa electricity power bill,electricity_payment,en
Clearing off p e d m electricity charges,electricity_payment,en
Managing n e s c o bill payment,electricity_payment,en
Fulfilling n p c l electricity obligation,electricity_payment,en
Finalizing uttarakhand power corporation power bill,electricity_payment,en
Completing t p southern odisha distribution electricity transaction,electricity_payment,en
Taking care of n b p d c l bill settlement,electricity_payment,en
Closing m p madhya kshetra vidyut vitaran urban power payment,electricity_payment,en
Concluding d n h p d c l electricity bill,electricity_payment,en
Settling hescom bill online from upi,electricity_payment,en
Upi for Paying kerala electricity board electricity bill,electricity_payment,en
Upi payment for Clearing sikkim power rural power bill,electricity_payment,en
Pay from upi to settle bikaner electricity electricity expense,electricity_payment,en
Pay through upi balance for gift power company bill,electricity_payment,en
Upi payment to Settling m p madhya shetra vidyut vitaran power charges,electricity_payment,en
Taking care of madhya shetra vidyut rural electricity bill through upi account,electricity_payment,en
Use upi payment to Submit u h b v n power bill,electricity_payment,en
I need to settle my electricity bill before the due date,electricity_payment,en
I want to make a payment towards my power bill for this month,electricity_payment,en
planning to clear my outstanding electricity bill with the utility company,electricity_payment,en
I have to take care of my power bill as it's overdue,electricity_payment,en
need to budget for my upcoming electricity bill to avoid any late fees,electricity_payment,en
preparing to make a payment towards my electricity usage for the past month,electricity_payment,en
I'm aware of my power bill and will be making a payment shortly,electricity_payment,en
Settle my electricity bill in person at the utility company's office,electricity_payment,en
I need to pay the electricity bill from upi account,electricity_payment,en
Want to settle the power bill using upi balance,electricity_payment,en
It's my responsibility to cover the electricity expenses use my upi account,electricity_payment,en
Using upi I'm going to take care of the power bill,electricity_payment,en
Upi payment pay the electricity bill ,electricity_payment,en
Payment from Upi account to cover the power dues,electricity_payment,en
Use upi account to settle the electricity bill,electricity_payment,en
I want to take care of the power bill,electricity_payment,en
It's my duty to pay the electricity expenses,electricity_payment,en
I'll make sure to cover the power bill,electricity_payment,en
looking to pay my kannan devan hills plantations company private limited bill online for convenience,electricity_payment,en
I'm responsible for paying the hubli electricity bill for our household,electricity_payment,en
I need to make a payment to bikaner electricity for my electricity bill,electricity_payment,en
My intention is to settle my outstanding balance with jammu and kashmir power development department for my electricity usage,electricity_payment,en
Using upi I would like to remit funds to m p paschim shetra vidyut vitaran in order to cover my electricity charges,electricity_payment,en
It's time for me to pay my monthly electricity bill to p s p c l from upi balance,electricity_payment,en
I plan to make payment of my electricity bill to n b p d c l using upi account for the current billing cycle,electricity_payment,en
I want to clear my dues with s b p d c l for my recent electricity consumption,electricity_payment,en
I'm interested in making a payment to t p mumbai to cover my electricity expenses,electricity_payment,en
I'm looking to settle my pending electricity bill with s b p d c l,electricity_payment,en
My aim is to pay my electricity usage charges to west bengal state electricity distribution company,electricity_payment,en
I'm eager to settle my outstanding amount with c e s u for my electricity consumption from upi,electricity_payment,en
Need to pay u p c l for electricity bill,electricity_payment,en
Settling outstanding balance with bharatpur electricity services,electricity_payment,en
Remitting funds to torrent power surat for electricity charges,electricity_payment,en
Paying monthly electricity bill to n p c l,electricity_payment,en
