sentence,intent,language
It's my responsibility to cover the electricity expenses use my upi account,electricity_payment,en
Using upi I'm going to take care of the power bill,electricity_payment,en
Upi payment pay the electricity bill ,electricity_payment,en
Payment from Upi account to cover the power dues,electricity_payment,en
Use upi account to settle the electricity bill,electricity_payment,en
I want to take care of the power bill,electricity_payment,en
It's my duty to pay the electricity expenses,electricity_payment,en
I'll make sure to cover the power bill,electricity_payment,en
looking to pay my j b v n l bill online for convenience,electricity_payment,en
I'm responsible for paying the gulbarga electricity bill for our household,electricity_payment,en
I need to make a payment to t p a d l for my electricity bill,electricity_payment,en
My intention is to settle my outstanding balance with m p poorv kshetra vidyut vitaran for my electricity usage,electricity_payment,en
Using upi I would like to remit funds to d n h power distribution company limited in order to cover my electricity charges,electricity_payment,en
It's time for me to pay my monthly electricity bill to mizoram power from upi balance,electricity_payment,en
I plan to make payment of my electricity bill to s b p d c l using upi account for the current billing cycle,electricity_payment,en
I want to clear my dues with m p vidyut rural for my recent electricity consumption,electricity_payment,en
I'm interested in making a payment to m p vidyut rural to cover my electricity expenses,electricity_payment,en
I'm looking to settle my pending electricity bill with uttar pradesh power rural,electricity_payment,en
My aim is to pay my electricity usage charges to paschim shetra vidyut vitaran,electricity_payment,en
I'm eager to settle my outstanding amount with j k p d d for my electricity consumption from upi,electricity_payment,en
Need to pay chamundeshwari electricity for electricity bill,electricity_payment,en
Settling outstanding balance with gulbarga electricity,electricity_payment,en
Remitting funds to t p western odisha distribution for electricity charges,electricity_payment,en
Paying monthly electricity bill to department of power government of arunachal pradesh,electricity_payment,en
Reimbursing paschim shetra vidyut vitaran for current billing cycle,electricity_payment,en
Use upi for Clearing dues with madhya shetra vidyut vitran rural for electricity consumption,electricity_payment,en
Making payment to bharatpur electricity services for electricity expenses,electricity_payment,en
Settling pending electricity bill with u p p c l urban,electricity_payment,en
Paying electricity charges to jharkhand bijli vitran nigam,electricity_payment,en
Clearing outstanding amount with electricity department chandigarh for electricity usage,electricity_payment,en
electricity bill,electricity_payment,en
i want to pay my electricity bill,electricity_payment,en
pay electricity bill,electricity_payment,en
electricity bill,electricity_payment,en
pay for electricity,electricity_payment,en
pay electricity,electricity_payment,en
Paying electricity bill,electricity_payment,en
Settling power bill online,electricity_payment,en
Covering electricity bill,electricity_payment,en
Clearing power bill balance,electricity_payment,en
Handling electricity bill payment,electricity_payment,en
Taking care of power bill,electricity_payment,en
Settling electricity bill dues,electricity_payment,en
Paying power bill online,electricity_payment,en
Clearing electricity bill balance,electricity_payment,en
Handling power bill payment,electricity_payment,en
Pay electricity bill,electricity_payment,en
Pay for electricity,electricity_payment,en
Make payment for electricity,electricity_payment,en
payment for electricity bill,electricity_payment,en
Electricity bill payment,electricity_payment,en
Check electricity bill,electricity_payment,en
Check electricity dues,electricity_payment,en
Paying electricity bill through upi,electricity_payment,en
Settling power bill using upi,electricity_payment,en
Covering electricity dues from upi balance,electricity_payment,en
Clearing power bill balance fthrough upi account,electricity_payment,en
Upi pay to Handle electricity bill payment,electricity_payment,en
Paying from upi to pay power bill,electricity_payment,en
Make payment from upi for electricity bill,electricity_payment,en
Upi payment for power bill online,electricity_payment,en
Paying electricity bill through UPI,electricity_payment,en
Using UPI for settling power bill online,electricity_payment,en
Use UPI to pay electricity bill today,electricity_payment,en
Clearing power bill balance. Make payment through upi account,electricity_payment,en
Handling electricity bill payment,electricity_payment,en
Taking care of power bill. Pay from upi account,electricity_payment,en
Settling electricity bill dues,electricity_payment,en
Paying power bill online,electricity_payment,en
Clearing electricity bill balance,electricity_payment,en
Handling power bill payment,electricity_payment,en
Pay electricity bill,electricity_payment,en
Pay for electricity,electricity_payment,en
Make payment for electricity,electricity_payment,en
payment for electricity bill,electricity_payment,en
Electricity bill payment,electricity_payment,en
Settling kerala state electricity bill online,electricity_payment,en
Paying dakshin haryana bijli vitran nigam electricity bill,electricity_payment,en
Clearing eastern power company power bill,electricity_payment,en
Covering u h b v n electricity expense,electricity_payment,en
Handling meghalaya power distribution corporation bill payment,electricity_payment,en
Settling tamil nadu electricity board power charges,electricity_payment,en
Taking care of eastern power company electricity bill,electricity_payment,en
Submitting c e s c power bill,electricity_payment,en
Remitting t p renewables microgrid electricity payment,electricity_payment,en
Making n b p d c l bill payment,electricity_payment,en
Finishing m p poorv shetra vidyut vitaran electricity dues,electricity_payment,en
Resolving sikkim power rural power bill,electricity_payment,en
Clearing off gescom electricity charges,electricity_payment,en
Managing w e s c o bill payment,electricity_payment,en
Fulfilling chattisgarh state power distribution co limited electricity obligation,electricity_payment,en
Finalizing d d e d power bill,electricity_payment,en
Completing p y e b electricity transaction,electricity_payment,en
Taking care of dakshin gujarat vij company limited bill settlement,electricity_payment,en
Closing chattisgarh state power distribution co limited power payment,electricity_payment,en
Concluding m p madhya kshetra vidyut vitaran rural electricity bill,electricity_payment,en
Settling nesco bill online from upi,electricity_payment,en
Upi for Paying dakshin haryana bijli vitran nigam electricity bill,electricity_payment,en
Upi payment for Clearing madhya gujarat vij company power bill,electricity_payment,en
Pay from upi to settle m p madhya kshetra vidyut vitaran electricity expense,electricity_payment,en
Pay through upi balance for calcutta electric supply corporation bill,electricity_payment,en
Upi payment to Settling uttar gujarat vij company power charges,electricity_payment,en
Taking care of t c e d electricity bill through upi account,electricity_payment,en
Use upi payment to Submit t c e d power bill,electricity_payment,en
I need to settle my electricity bill before the due date,electricity_payment,en
I want to make a payment towards my power bill for this month,electricity_payment,en
planning to clear my outstanding electricity bill with the utility company,electricity_payment,en
I have to take care of my power bill as it's overdue,electricity_payment,en
need to budget for my upcoming electricity bill to avoid any late fees,electricity_payment,en
preparing to make a payment towards my electricity usage for the past month,electricity_payment,en
I'm aware of my power bill and will be making a payment shortly,electricity_payment,en
Settle my electricity bill in person at the utility company's office,electricity_payment,en
I need to pay the electricity bill from upi account,electricity_payment,en
Want to settle the power bill using upi balance,electricity_payment,en
It's my responsibility to cover the electricity expenses use my upi account,electricity_payment,en
Using upi I'm going to take care of the power bill,electricity_payment,en
Upi payment pay the electricity bill ,electricity_payment,en
Payment from Upi account to cover the power dues,electricity_payment,en
Use upi account to settle the electricity bill,electricity_payment,en
I want to take care of the power bill,electricity_payment,en
It's my duty to pay the electricity expenses,electricity_payment,en
I'll make sure to cover the power bill,electricity_payment,en
looking to pay my goa electricity bill online for convenience,electricity_payment,en
I'm responsible for paying the d n h power bill for our household,electricity_payment,en
I need to make a payment to b e s t mumbai for my electricity bill,electricity_payment,en
My intention is to settle my outstanding balance with tata power western odisha for my electricity usage,electricity_payment,en
Using upi I would like to remit funds to d n h power distribution company limited in order to cover my electricity charges,electricity_payment,en
It's time for me to pay my monthly electricity bill to jammu and kashmir power development department from upi balance,electricity_payment,en
I plan to make payment of my electricity bill to puducherry electricity department using upi account for the current billing cycle,electricity_payment,en
I want to clear my dues with m p p k v v c l rural for my recent electricity consumption,electricity_payment,en
I'm interested in making a payment to torrent power agra to cover my electricity expenses,electricity_payment,en
I'm looking to settle my pending electricity bill with gift power,electricity_payment,en
My aim is to pay my electricity usage charges to m p poorv vidyut,electricity_payment,en
I'm eager to settle my outstanding amount with n d m c electricity for my electricity consumption from upi,electricity_payment,en
Need to pay b e s l for electricity bill,electricity_payment,en
Settling outstanding balance with south bihar power distribution company,electricity_payment,en
Remitting funds to jamshedpur utilities for electricity charges,electricity_payment,en
Paying monthly electricity bill to jusco,electricity_payment,en
Reimbursing tamil nadu electricity board for current billing cycle,electricity_payment,en
Use upi for Clearing dues with uttar pradesh power corporation rural for electricity consumption,electricity_payment,en
Making payment to s k m p w r rural for electricity expenses,electricity_payment,en
Settling pending electricity bill with chattisgarh power,electricity_payment,en
Paying electricity charges to himachal pradesh state electricity board,electricity_payment,en
Clearing outstanding amount with a v v n l for electricity usage,electricity_payment,en
electricity bill,electricity_payment,en
i want to pay my electricity bill,electricity_payment,en
pay electricity bill,electricity_payment,en
electricity bill,electricity_payment,en
pay for electricity,electricity_payment,en
pay electricity,electricity_payment,en
Paying electricity bill,electricity_payment,en
Settling power bill online,electricity_payment,en
Covering electricity bill,electricity_payment,en
Clearing power bill balance,electricity_payment,en
Handling electricity bill payment,electricity_payment,en
Taking care of power bill,electricity_payment,en
Settling electricity bill dues,electricity_payment,en
Paying power bill online,electricity_payment,en
Clearing electricity bill balance,electricity_payment,en
Handling power bill payment,electricity_payment,en
Pay electricity bill,electricity_payment,en
Pay for electricity,electricity_payment,en
Make payment for electricity,electricity_payment,en
payment for electricity bill,electricity_payment,en
Electricity bill payment,electricity_payment,en
Check electricity bill,electricity_payment,en
Check electricity dues,electricity_payment,en
Paying electricity bill through upi,electricity_payment,en
Settling power bill using upi,electricity_payment,en
Covering electricity dues from upi balance,electricity_payment,en
Clearing power bill balance fthrough upi account,electricity_payment,en
Upi pay to Handle electricity bill payment,electricity_payment,en
Paying from upi to pay power bill,electricity_payment,en
Make payment from upi for electricity bill,electricity_payment,en
Upi payment for power bill online,electricity_payment,en
Paying electricity bill through UPI,electricity_payment,en
Using UPI for settling power bill online,electricity_payment,en
Use UPI to pay electricity bill today,electricity_payment,en
Clearing power bill balance. Make payment through upi account,electricity_payment,en
Handling electricity bill payment,electricity_payment,en
Taking care of power bill. Pay from upi account,electricity_payment,en
Settling electricity bill dues,electricity_payment,en
Paying power bill online,electricity_payment,en
Clearing electricity bill balance,electricity_payment,en
Handling power bill payment,electricity_payment,en
Pay electricity bill,electricity_payment,en
Pay for electricity,electricity_payment,en
Make payment for electricity,electricity_payment,en
payment for electricity bill,electricity_payment,en
Electricity bill payment,electricity_payment,en
Settling cescom bill online,electricity_payment,en
Paying u p p c l rural electricity bill,electricity_payment,en
Clearing d h b v n power bill,electricity_payment,en
Covering electricity department chandigarh electricity expense,electricity_payment,en
Handling m p poorv shetra vidyut vitaran rural bill payment,electricity_payment,en
Settling lakshadweep electricity power charges,electricity_payment,en
Taking care of j and k power electricity bill,electricity_payment,en
Submitting m p paschim kshetra vidyut vitaran power bill,electricity_payment,en
Remitting n p c l noida power electricity payment,electricity_payment,en
Making bikaner electricity bill payment,electricity_payment,en
Finishing lakshadweep electricity electricity dues,electricity_payment,en
Resolving ajmer vidyut vitran nigam limited power bill,electricity_payment,en
Clearing off hubli electricity supply company electricity charges,electricity_payment,en
Managing gulbarga electricity supply company bill payment,electricity_payment,en
Fulfilling jharkhand bijli vitran nigam electricity obligation,electricity_payment,en
Finalizing dakshin gujarat vij company power bill,electricity_payment,en
Completing bharatpur electricity services electricity transaction,electricity_payment,en
Taking care of torrent power ahmedabad bill settlement,electricity_payment,en
Closing n p c l noida power power payment,electricity_payment,en
Concluding m p poorv vidyut electricity bill,electricity_payment,en
Settling bescom bill online from upi,electricity_payment,en
Upi for Paying west bengal electricity company electricity bill,electricity_payment,en
Upi payment for Clearing mangalore electricity supply company power bill,electricity_payment,en
Pay from upi to settle kannan devan hills plantations company private limited electricity expense,electricity_payment,en
Pay through upi balance for c s p d c l bill,electricity_payment,en
Upi payment to Settling sikkim power rural power charges,electricity_payment,en
Taking care of m p p k v v c l electricity bill through upi account,electricity_payment,en
Use upi payment to Submit m p p k v v c l rural power bill,electricity_payment,en
I need to settle my electricity bill before the due date,electricity_payment,en
I want to make a payment towards my power bill for this month,electricity_payment,en
planning to clear my outstanding electricity bill with the utility company,electricity_payment,en
I have to take care of my power bill as it's overdue,electricity_payment,en
need to budget for my upcoming electricity bill to avoid any late fees,electricity_payment,en
preparing to make a payment towards my electricity usage for the past month,electricity_payment,en
I'm aware of my power bill and will be making a payment shortly,electricity_payment,en
Settle my electricity bill in person at the utility company's office,electricity_payment,en
I need to pay the electricity bill from upi account,electricity_payment,en
Want to settle the power bill using upi balance,electricity_payment,en
It's my responsibility to cover the electricity expenses use my upi account,electricity_payment,en
Using upi I'm going to take care of the power bill,electricity_payment,en
Upi payment pay the electricity bill ,electricity_payment,en
Payment from Upi account to cover the power dues,electricity_payment,en
Use upi account to settle the electricity bill,electricity_payment,en
I want to take care of the power bill,electricity_payment,en
It's my duty to pay the electricity expenses,electricity_payment,en
I'll make sure to cover the power bill,electricity_payment,en
looking to pay my a p e p d c l bill online for convenience,electricity_payment,en
I'm responsible for paying the b e s t mumbai bill for our household,electricity_payment,en
I need to make a payment to north bihar power distribution company for my electricity bill,electricity_payment,en
My intention is to settle my outstanding balance with electricity department chandigarh for my electricity usage,electricity_payment,en
Using upi I would like to remit funds to government of puducherry electricity department in order to cover my electricity charges,electricity_payment,en
It's time for me to pay my monthly electricity bill to p e d m from upi balance,electricity_payment,en
I plan to make payment of my electricity bill to kanpur electricity using upi account for the current billing cycle,electricity_payment,en
I want to clear my dues with a p s p d c l for my recent electricity consumption,electricity_payment,en
I'm interested in making a payment to t c e d to cover my electricity expenses,electricity_payment,en
I'm looking to settle my pending electricity bill with assam power distribution company limited,electricity_payment,en
My aim is to pay my electricity usage charges to tata power mumbai,electricity_payment,en
I'm eager to settle my outstanding amount with t c e d for my electricity consumption from upi,electricity_payment,en
Need to pay government of puducherry electricity department for electricity bill,electricity_payment,en
Settling outstanding balance with kerala electricity board,electricity_payment,en
Remitting funds to paschim gujarat vij company for electricity charges,electricity_payment,en
Paying monthly electricity bill to gulbarga electricity supply company,electricity_payment,en
Reimbursing madhya shetra vidyut rural for current billing cycle,electricity_payment,en
Use upi for Clearing dues with p g v c l for electricity consumption,electricity_payment,en
Making payment to uttar pradesh power rural for electricity expenses,electricity_payment,en
Settling pending electricity bill with kannan devan hills plantations company private limited,electricity_payment,en
Paying electricity charges to b e s t mumbai,electricity_payment,en
Clearing outstanding amount with m e p d c l for electricity usage,electricity_payment,en
electricity bill,electricity_payment,en
i want to pay my electricity bill,electricity_payment,en
pay electricity bill,electricity_payment,en
electricity bill,electricity_payment,en
pay for electricity,electricity_payment,en
pay electricity,electricity_payment,en
Paying electricity bill,electricity_payment,en
Settling power bill online,electricity_payment,en
Covering electricity bill,electricity_payment,en
Clearing power bill balance,electricity_payment,en
Handling electricity bill payment,electricity_payment,en
Taking care of power bill,electricity_payment,en
Settling electricity bill dues,electricity_payment,en
Paying power bill online,electricity_payment,en
Clearing electricity bill balance,electricity_payment,en
Handling power bill payment,electricity_payment,en
Pay electricity bill,electricity_payment,en
Pay for electricity,electricity_payment,en
Make payment for electricity,electricity_payment,en
payment for electricity bill,electricity_payment,en
Electricity bill payment,electricity_payment,en
Check electricity bill,electricity_payment,en
Check electricity dues,electricity_payment,en
Paying electricity bill through upi,electricity_payment,en
Settling power bill using upi,electricity_payment,en
Covering electricity dues from upi balance,electricity_payment,en
Clearing power bill balance fthrough upi account,electricity_payment,en
Upi pay to Handle electricity bill payment,electricity_payment,en
Paying from upi to pay power bill,electricity_payment,en
Make payment from upi for electricity bill,electricity_payment,en
Upi payment for power bill online,electricity_payment,en
Paying electricity bill through UPI,electricity_payment,en
Using UPI for settling power bill online,electricity_payment,en
Use UPI to pay electricity bill today,electricity_payment,en
Clearing power bill balance. Make payment through upi account,electricity_payment,en
Handling electricity bill payment,electricity_payment,en
Taking care of power bill. Pay from upi account,electricity_payment,en
Settling electricity bill dues,electricity_payment,en
Paying power bill online,electricity_payment,en
Clearing electricity bill balance,electricity_payment,en
Handling power bill payment,electricity_payment,en
Pay electricity bill,electricity_payment,en
Pay for electricity,electricity_payment,en
Make payment for electricity,electricity_payment,en
payment for electricity bill,electricity_payment,en
Electricity bill payment,electricity_payment,en
Settling n p c l noida power bill online,electricity_payment,en
Paying maharashtra state electricity electricity bill,electricity_payment,en
Clearing m p poorv shetra vidyut vitaran rural power bill,electricity_payment,en
Covering himachal pradesh electricity board electricity expense,electricity_payment,en
Handling thrissur corporation electricity department bill payment,electricity_payment,en
Settling d h b v n power charges,electricity_payment,en
Taking care of bharatpur electricity electricity bill,electricity_payment,en
Submitting chamundeshwari electricity power bill,electricity_payment,en
Remitting bikaner electricity electricity payment,electricity_payment,en
Making kesco bill payment,electricity_payment,en
Finishing jammu and kashmir power development department electricity dues,electricity_payment,en
Resolving kerala state electricity power bill,electricity_payment,en
Clearing off tata power renewables electricity charges,electricity_payment,en
Managing d n h power company bill payment,electricity_payment,en
Fulfilling madhya shetra vidyut vitaran electricity obligation,electricity_payment,en
Finalizing kanpur electricity supply company power bill,electricity_payment,en
Completing madhya shetra vidyut vitran rural electricity transaction,electricity_payment,en
Taking care of torrent power bhiwandi bill settlement,electricity_payment,en
Closing thrissur electricity department power payment,electricity_payment,en
Concluding west bengal electricity company electricity bill,electricity_payment,en
Settling d d e d bill online from upi,electricity_payment,en
Upi for Paying j and k power electricity bill,electricity_payment,en
Upi payment for Clearing t c e d power bill,electricity_payment,en
Pay from upi to settle electricity department chandigarh electricity expense,electricity_payment,en
Pay through upi balance for p s p c l bill,electricity_payment,en
Upi payment to Settling d n h power distribution company limited power charges,electricity_payment,en
Taking care of tata power western odisha electricity bill through upi account,electricity_payment,en
Use upi payment to Submit torrent power power bill,electricity_payment,en
I need to settle my electricity bill before the due date,electricity_payment,en
I want to make a payment towards my power bill for this month,electricity_payment,en
planning to clear my outstanding electricity bill with the utility company,electricity_payment,en
I have to take care of my power bill as it's overdue,electricity_payment,en
need to budget for my upcoming electricity bill to avoid any late fees,electricity_payment,en
preparing to make a payment towards my electricity usage for the past month,electricity_payment,en
I'm aware of my power bill and will be making a payment shortly,electricity_payment,en
Settle my electricity bill in person at the utility company's office,electricity_payment,en
I need to pay the electricity bill from upi account,electricity_payment,en
Want to settle the power bill using upi balance,electricity_payment,en
It's my responsibility to cover the electricity expenses use my upi account,electricity_payment,en
Using upi I'm going to take care of the power bill,electricity_payment,en
Upi payment pay the electricity bill ,electricity_payment,en
Payment from Upi account to cover the power dues,electricity_payment,en
Use upi account to settle the electricity bill,electricity_payment,en
I want to take care of the power bill,electricity_payment,en
It's my duty to pay the electricity expenses,electricity_payment,en
I'll make sure to cover the power bill,electricity_payment,en
looking to pay my m p paschim shetra vidyut vitaran bill online for convenience,electricity_payment,en
I'm responsible for paying the rajdhani power bill for our household,electricity_payment,en
I need to make a payment to b s e s yamuna power limited for my electricity bill,electricity_payment,en
My intention is to settle my outstanding balance with maharashtra state electricity for my electricity usage,electricity_payment,en
