sentence,intent,language
electricity bill,electricity_payment,en
i want to pay my electricity bill,electricity_payment,en
pay electricity bill,electricity_payment,en
electricity bill,electricity_payment,en
pay for electricity,electricity_payment,en
pay electricity,electricity_payment,en
Paying electricity bill,electricity_payment,en
Settling power bill online,electricity_payment,en
Covering electricity bill,electricity_payment,en
Clearing power bill balance,electricity_payment,en
Handling electricity bill payment,electricity_payment,en
Taking care of power bill,electricity_payment,en
Settling electricity bill dues,electricity_payment,en
Paying power bill online,electricity_payment,en
Clearing electricity bill balance,electricity_payment,en
Handling power bill payment,electricity_payment,en
Pay electricity bill,electricity_payment,en
Pay for electricity,electricity_payment,en
Make payment for electricity,electricity_payment,en
payment for electricity bill,electricity_payment,en
Electricity bill payment,electricity_payment,en
Check electricity bill,electricity_payment,en
Check electricity dues,electricity_payment,en
Paying electricity bill through upi,electricity_payment,en
Settling power bill using upi,electricity_payment,en
Covering electricity dues from upi balance,electricity_payment,en
Clearing power bill balance fthrough upi account,electricity_payment,en
Upi pay to Handle electricity bill payment,electricity_payment,en
Paying from upi to pay power bill,electricity_payment,en
Make payment from upi for electricity bill,electricity_payment,en
Upi payment for power bill online,electricity_payment,en
Paying electricity bill through UPI,electricity_payment,en
Using UPI for settling power bill online,electricity_payment,en
Use UPI to pay electricity bill today,electricity_payment,en
Clearing power bill balance. Make payment through upi account,electricity_payment,en
Handling electricity bill payment,electricity_payment,en
Taking care of power bill. Pay from upi account,electricity_payment,en
Settling electricity bill dues,electricity_payment,en
Paying power bill online,electricity_payment,en
Clearing electricity bill balance,electricity_payment,en
Handling power bill payment,electricity_payment,en
Pay electricity bill,electricity_payment,en
Pay for electricity,electricity_payment,en
Make payment for electricity,electricity_payment,en
payment for electricity bill,electricity_payment,en
Electricity bill payment,electricity_payment,en
Settling goa electricity bill online,electricity_payment,en
Paying chamundeshwari electricity electricity bill,electricity_payment,en
Clearing m p p k v v c l power bill,electricity_payment,en
Covering gift power company electricity expense,electricity_payment,en
Handling sikkim power rural bill payment,electricity_payment,en
Settling n p c l noida power power charges,electricity_payment,en
Taking care of calcutta electric supply corporation electricity bill,electricity_payment,en
Submitting t p central odisha distribution power bill,electricity_payment,en
Remitting t p western odisha distribution electricity payment,electricity_payment,en
Making torrent power surat bill payment,electricity_payment,en
Finishing chamundeshwari electricity electricity dues,electricity_payment,en
Resolving jharkhand bijli vitran nigam power bill,electricity_payment,en
Clearing off dakshin haryana bijli vitran nigam electricity charges,electricity_payment,en
Managing best bill payment,electricity_payment,en
Fulfilling h p s e b electricity obligation,electricity_payment,en
Finalizing eastern power company power bill,electricity_payment,en
Completing e d c electricity transaction,electricity_payment,en
Taking care of s n d l bill settlement,electricity_payment,en
Closing m p p k v v c l urban power payment,electricity_payment,en
Concluding p g v c l electricity bill,electricity_payment,en
Settling daman and diu electricity bill online from upi,electricity_payment,en
Upi for Paying kerala electricity board electricity bill,electricity_payment,en
Upi payment for Clearing uttar haryana bijli vitran nigam power bill,electricity_payment,en
Pay from upi to settle m p poorv kshetra vidyut vitaran electricity expense,electricity_payment,en
Pay through upi balance for tata power renewables bill,electricity_payment,en
Upi payment to Settling m p poorv shetra vidyut vitaran power charges,electricity_payment,en
Taking care of dakshin gujarat vij company limited electricity bill through upi account,electricity_payment,en
Use upi payment to Submit department of power government of arunachal pradesh power bill,electricity_payment,en
I need to settle my electricity bill before the due date,electricity_payment,en
I want to make a payment towards my power bill for this month,electricity_payment,en
planning to clear my outstanding electricity bill with the utility company,electricity_payment,en
I have to take care of my power bill as it's overdue,electricity_payment,en
need to budget for my upcoming electricity bill to avoid any late fees,electricity_payment,en
preparing to make a payment towards my electricity usage for the past month,electricity_payment,en
I'm aware of my power bill and will be making a payment shortly,electricity_payment,en
Settle my electricity bill in person at the utility company's office,electricity_payment,en
I need to pay the electricity bill from upi account,electricity_payment,en
Want to settle the power bill using upi balance,electricity_payment,en
It's my responsibility to cover the electricity expenses use my upi account,electricity_payment,en
Using upi I'm going to take care of the power bill,electricity_payment,en
Upi payment pay the electricity bill ,electricity_payment,en
Payment from Upi account to cover the power dues,electricity_payment,en
Use upi account to settle the electricity bill,electricity_payment,en
I want to take care of the power bill,electricity_payment,en
It's my duty to pay the electricity expenses,electricity_payment,en
I'll make sure to cover the power bill,electricity_payment,en
looking to pay my jaipur vidyut vitran nigam bill online for convenience,electricity_payment,en
I'm responsible for paying the uttar pradesh power rural bill for our household,electricity_payment,en
I need to make a payment to c e s c for my electricity bill,electricity_payment,en
My intention is to settle my outstanding balance with m p madhya shetra vidyut vitaran for my electricity usage,electricity_payment,en
Using upi I would like to remit funds to m p p k v v c l in order to cover my electricity charges,electricity_payment,en
It's time for me to pay my monthly electricity bill to u p p c l rural from upi balance,electricity_payment,en
I plan to make payment of my electricity bill to p y e b using upi account for the current billing cycle,electricity_payment,en
I want to clear my dues with t p r m g for my recent electricity consumption,electricity_payment,en
I'm interested in making a payment to t p r m g to cover my electricity expenses,electricity_payment,en
I'm looking to settle my pending electricity bill with h p s e b,electricity_payment,en
My aim is to pay my electricity usage charges to dakshin gujarat vij company,electricity_payment,en
I'm eager to settle my outstanding amount with a p e p d c l for my electricity consumption from upi,electricity_payment,en
Need to pay mizoram power for electricity bill,electricity_payment,en
Settling outstanding balance with gift power,electricity_payment,en
Remitting funds to southern power company for electricity charges,electricity_payment,en
Paying monthly electricity bill to c e s c,electricity_payment,en
Reimbursing goa electricity for current billing cycle,electricity_payment,en
Use upi for Clearing dues with d n h power company for electricity consumption,electricity_payment,en
Making payment to himachal pradesh state electricity board for electricity expenses,electricity_payment,en
Settling pending electricity bill with bikaner electricity,electricity_payment,en
Paying electricity charges to hubli electricity supply company,electricity_payment,en
Clearing outstanding amount with uttar pradesh power rural for electricity usage,electricity_payment,en
electricity bill,electricity_payment,en
i want to pay my electricity bill,electricity_payment,en
pay electricity bill,electricity_payment,en
electricity bill,electricity_payment,en
pay for electricity,electricity_payment,en
pay electricity,electricity_payment,en
Paying electricity bill,electricity_payment,en
Settling power bill online,electricity_payment,en
Covering electricity bill,electricity_payment,en
Clearing power bill balance,electricity_payment,en
Handling electricity bill payment,electricity_payment,en
Taking care of power bill,electricity_payment,en
Settling electricity bill dues,electricity_payment,en
Paying power bill online,electricity_payment,en
Clearing electricity bill balance,electricity_payment,en
Handling power bill payment,electricity_payment,en
Pay electricity bill,electricity_payment,en
Pay for electricity,electricity_payment,en
Make payment for electricity,electricity_payment,en
payment for electricity bill,electricity_payment,en
Electricity bill payment,electricity_payment,en
Check electricity bill,electricity_payment,en
Check electricity dues,electricity_payment,en
Paying electricity bill through upi,electricity_payment,en
Settling power bill using upi,electricity_payment,en
Covering electricity dues from upi balance,electricity_payment,en
Clearing power bill balance fthrough upi account,electricity_payment,en
Upi pay to Handle electricity bill payment,electricity_payment,en
Paying from upi to pay power bill,electricity_payment,en
Make payment from upi for electricity bill,electricity_payment,en
Upi payment for power bill online,electricity_payment,en
Paying electricity bill through UPI,electricity_payment,en
Using UPI for settling power bill online,electricity_payment,en
Use UPI to pay electricity bill today,electricity_payment,en
Clearing power bill balance. Make payment through upi account,electricity_payment,en
Handling electricity bill payment,electricity_payment,en
Taking care of power bill. Pay from upi account,electricity_payment,en
Settling electricity bill dues,electricity_payment,en
Paying power bill online,electricity_payment,en
Clearing electricity bill balance,electricity_payment,en
Handling power bill payment,electricity_payment,en
Pay electricity bill,electricity_payment,en
Pay for electricity,electricity_payment,en
Make payment for electricity,electricity_payment,en
payment for electricity bill,electricity_payment,en
Electricity bill payment,electricity_payment,en
Settling uttarakhand power corporation bill online,electricity_payment,en
Paying b e s t mumbai electricity bill,electricity_payment,en
Clearing chattisgarh state power distribution power bill,electricity_payment,en
Covering t p southern odisha distribution electricity expense,electricity_payment,en
Handling yamuna power limited bill payment,electricity_payment,en
Settling dakshin gujarat vij company power charges,electricity_payment,en
Taking care of jaipur vidyut vitran nigam electricity bill,electricity_payment,en
Submitting chamundeshwari electricity power bill,electricity_payment,en
Remitting power and electricity department mizoram electricity payment,electricity_payment,en
Making j and k power bill payment,electricity_payment,en
Finishing yamuna power limited electricity dues,electricity_payment,en
Resolving t c e d power bill,electricity_payment,en
Clearing off jamshedpur utilities electricity charges,electricity_payment,en
Managing uttar haryana bijli nigam bill payment,electricity_payment,en
Fulfilling ajmer vidyut vitran nigam limited electricity obligation,electricity_payment,en
Finalizing u p p c l urban power bill,electricity_payment,en
Completing m p vidyut urban electricity transaction,electricity_payment,en
Taking care of assam power company bill settlement,electricity_payment,en
Closing jaipur vidyut vitran nigam power payment,electricity_payment,en
Concluding jharkhand bijli vitran nigam electricity bill,electricity_payment,en
Settling j k p d d bill online from upi,electricity_payment,en
Upi for Paying himachal pradesh electricity board electricity bill,electricity_payment,en
Upi payment for Clearing kerala electricity board power bill,electricity_payment,en
Pay from upi to settle t p renewables microgrid electricity expense,electricity_payment,en
Pay through upi balance for sikkim power rural bill,electricity_payment,en
Upi payment to Settling ajmer vidyut vitran nigam power charges,electricity_payment,en
Taking care of kannan devan hills plantations company electricity bill through upi account,electricity_payment,en
Use upi payment to Submit kerala electricity board power bill,electricity_payment,en
I need to settle my electricity bill before the due date,electricity_payment,en
I want to make a payment towards my power bill for this month,electricity_payment,en
planning to clear my outstanding electricity bill with the utility company,electricity_payment,en
I have to take care of my power bill as it's overdue,electricity_payment,en
need to budget for my upcoming electricity bill to avoid any late fees,electricity_payment,en
preparing to make a payment towards my electricity usage for the past month,electricity_payment,en
I'm aware of my power bill and will be making a payment shortly,electricity_payment,en
Settle my electricity bill in person at the utility company's office,electricity_payment,en
I need to pay the electricity bill from upi account,electricity_payment,en
Want to settle the power bill using upi balance,electricity_payment,en
It's my responsibility to cover the electricity expenses use my upi account,electricity_payment,en
Using upi I'm going to take care of the power bill,electricity_payment,en
Upi payment pay the electricity bill ,electricity_payment,en
Payment from Upi account to cover the power dues,electricity_payment,en
Use upi account to settle the electricity bill,electricity_payment,en
I want to take care of the power bill,electricity_payment,en
It's my duty to pay the electricity expenses,electricity_payment,en
I'll make sure to cover the power bill,electricity_payment,en
looking to pay my j k p d d bill online for convenience,electricity_payment,en
I'm responsible for paying the n p c l bill for our household,electricity_payment,en
I need to make a payment to d n h power company for my electricity bill,electricity_payment,en
My intention is to settle my outstanding balance with new delhi municipal council electricity for my electricity usage,electricity_payment,en
Using upi I would like to remit funds to j k p d d in order to cover my electricity charges,electricity_payment,en
It's time for me to pay my monthly electricity bill to uttar gujarat vij company from upi balance,electricity_payment,en
I plan to make payment of my electricity bill to torrent power using upi account for the current billing cycle,electricity_payment,en
I want to clear my dues with tripura electricity for my recent electricity consumption,electricity_payment,en
I'm interested in making a payment to m p madhya kshetra vidyut vitaran urban to cover my electricity expenses,electricity_payment,en
I'm looking to settle my pending electricity bill with department of power nagaland,electricity_payment,en
My aim is to pay my electricity usage charges to d n h p d c l,electricity_payment,en
I'm eager to settle my outstanding amount with c s p d c l for my electricity consumption from upi,electricity_payment,en
Need to pay gescom for electricity bill,electricity_payment,en
Settling outstanding balance with puducherry electricity department,electricity_payment,en
Remitting funds to u p p c l rural for electricity charges,electricity_payment,en
Paying monthly electricity bill to m p madhya shetra vidyut vitaran,electricity_payment,en
Reimbursing gift power company for current billing cycle,electricity_payment,en
Use upi for Clearing dues with m p p k v v c l urban for electricity consumption,electricity_payment,en
Making payment to kerala electricity board for electricity expenses,electricity_payment,en
Settling pending electricity bill with n b p d c l,electricity_payment,en
Paying electricity charges to m p poorv shetra vidyut vitaran,electricity_payment,en
Clearing outstanding amount with bikaner electricity supply for electricity usage,electricity_payment,en
electricity bill,electricity_payment,en
i want to pay my electricity bill,electricity_payment,en
pay electricity bill,electricity_payment,en
electricity bill,electricity_payment,en
pay for electricity,electricity_payment,en
pay electricity,electricity_payment,en
Paying electricity bill,electricity_payment,en
Settling power bill online,electricity_payment,en
Covering electricity bill,electricity_payment,en
Clearing power bill balance,electricity_payment,en
Handling electricity bill payment,electricity_payment,en
Taking care of power bill,electricity_payment,en
Settling electricity bill dues,electricity_payment,en
Paying power bill online,electricity_payment,en
Clearing electricity bill balance,electricity_payment,en
Handling power bill payment,electricity_payment,en
Pay electricity bill,electricity_payment,en
Pay for electricity,electricity_payment,en
Make payment for electricity,electricity_payment,en
payment for electricity bill,electricity_payment,en
Electricity bill payment,electricity_payment,en
Check electricity bill,electricity_payment,en
Check electricity dues,electricity_payment,en
Paying electricity bill through upi,electricity_payment,en
Settling power bill using upi,electricity_payment,en
Covering electricity dues from upi balance,electricity_payment,en
Clearing power bill balance fthrough upi account,electricity_payment,en
Upi pay to Handle electricity bill payment,electricity_payment,en
Paying from upi to pay power bill,electricity_payment,en
Make payment from upi for electricity bill,electricity_payment,en
Upi payment for power bill online,electricity_payment,en
Paying electricity bill through UPI,electricity_payment,en
Using UPI for settling power bill online,electricity_payment,en
Use UPI to pay electricity bill today,electricity_payment,en
Clearing power bill balance. Make payment through upi account,electricity_payment,en
Handling electricity bill payment,electricity_payment,en
Taking care of power bill. Pay from upi account,electricity_payment,en
Settling electricity bill dues,electricity_payment,en
Paying power bill online,electricity_payment,en
Clearing electricity bill balance,electricity_payment,en
Handling power bill payment,electricity_payment,en
Pay electricity bill,electricity_payment,en
Pay for electricity,electricity_payment,en
Make payment for electricity,electricity_payment,en
payment for electricity bill,electricity_payment,en
Electricity bill payment,electricity_payment,en
Settling hescom bill online,electricity_payment,en
Paying hescom electricity bill,electricity_payment,en
Clearing tata power renewables power bill,electricity_payment,en
Covering dakshin gujarat vij company limited electricity expense,electricity_payment,en
Handling n d m c electricity bill payment,electricity_payment,en
Settling w b s e d c l power charges,electricity_payment,en
Taking care of adani electricity mumbai electricity bill,electricity_payment,en
Submitting chamundeshwari electricity power bill,electricity_payment,en
Remitting jammu and kashmir power development department electricity payment,electricity_payment,en
Making j and k power bill payment,electricity_payment,en
Finishing s k m p w r rural electricity dues,electricity_payment,en
Resolving uttar pradesh power urban power bill,electricity_payment,en
Clearing off central odisha distribution electricity charges,electricity_payment,en
Managing m p madhya shetra vidyut vitaran bill payment,electricity_payment,en
Fulfilling tata power western odisha electricity obligation,electricity_payment,en
Finalizing adani electricity mumbai power bill,electricity_payment,en
Completing madhya shetra vidyut rural electricity transaction,electricity_payment,en
Taking care of southern power distribution company bill settlement,electricity_payment,en
Closing chattisgarh state power distribution power payment,electricity_payment,en
Concluding dakshin haryana bijli vitran nigam electricity bill,electricity_payment,en
Settling u p p c l urban bill online from upi,electricity_payment,en
Upi for Paying madhya shetra vidyut vitaran electricity bill,electricity_payment,en
Upi payment for Clearing best power bill,electricity_payment,en
Pay from upi to settle tata power delhi electricity expense,electricity_payment,en
Pay through upi balance for west bengal electricity bill,electricity_payment,en
Upi payment to Settling c e s c power charges,electricity_payment,en
Taking care of n p c l electricity bill through upi account,electricity_payment,en
Use upi payment to Submit assam power company power bill,electricity_payment,en
I need to settle my electricity bill before the due date,electricity_payment,en
I want to make a payment towards my power bill for this month,electricity_payment,en
planning to clear my outstanding electricity bill with the utility company,electricity_payment,en
I have to take care of my power bill as it's overdue,electricity_payment,en
need to budget for my upcoming electricity bill to avoid any late fees,electricity_payment,en
preparing to make a payment towards my electricity usage for the past month,electricity_payment,en
I'm aware of my power bill and will be making a payment shortly,electricity_payment,en
Settle my electricity bill in person at the utility company's office,electricity_payment,en
I need to pay the electricity bill from upi account,electricity_payment,en
Want to settle the power bill using upi balance,electricity_payment,en
It's my responsibility to cover the electricity expenses use my upi account,electricity_payment,en
Using upi I'm going to take care of the power bill,electricity_payment,en
Upi payment pay the electricity bill ,electricity_payment,en
Payment from Upi account to cover the power dues,electricity_payment,en
Use upi account to settle the electricity bill,electricity_payment,en
I want to take care of the power bill,electricity_payment,en
It's my duty to pay the electricity expenses,electricity_payment,en
I'll make sure to cover the power bill,electricity_payment,en
looking to pay my e d c bill online for convenience,electricity_payment,en
I'm responsible for paying the b s e s rajdhani power bill for our household,electricity_payment,en
I need to make a payment to bikaner electricity for my electricity bill,electricity_payment,en
My intention is to settle my outstanding balance with t p ajmer distribution for my electricity usage,electricity_payment,en
Using upi I would like to remit funds to rajdhani power in order to cover my electricity charges,electricity_payment,en
It's time for me to pay my monthly electricity bill to west bengal state electricity distribution company from upi balance,electricity_payment,en
I plan to make payment of my electricity bill to mangalore electricity supply company using upi account for the current billing cycle,electricity_payment,en
I want to clear my dues with department of power nagaland for my recent electricity consumption,electricity_payment,en
I'm interested in making a payment to dakshin gujarat vij company to cover my electricity expenses,electricity_payment,en
I'm looking to settle my pending electricity bill with hescom,electricity_payment,en
My aim is to pay my electricity usage charges to d o p n,electricity_payment,en
I'm eager to settle my outstanding amount with lakshadweep electricity for my electricity consumption from upi,electricity_payment,en
Need to pay ajmer vidyut vitran nigam for electricity bill,electricity_payment,en
Settling outstanding balance with uttar pradesh power corporation rural,electricity_payment,en
Remitting funds to t p southern odisha distribution for electricity charges,electricity_payment,en
Paying monthly electricity bill to a p d c l,electricity_payment,en
Reimbursing kerala electricity board for current billing cycle,electricity_payment,en
Use upi for Clearing dues with m p madhyashetra vidyut vitran rural for electricity consumption,electricity_payment,en
Making payment to j b v n l for electricity expenses,electricity_payment,en
Settling pending electricity bill with bharatpur electricity services,electricity_payment,en
Paying electricity charges to t p western odisha distribution,electricity_payment,en
Clearing outstanding amount with cescom for electricity usage,electricity_payment,en
electricity bill,electricity_payment,en
i want to pay my electricity bill,electricity_payment,en
pay electricity bill,electricity_payment,en
electricity bill,electricity_payment,en
pay for electricity,electricity_payment,en
pay electricity,electricity_payment,en
Paying electricity bill,electricity_payment,en
Settling power bill online,electricity_payment,en
Covering electricity bill,electricity_payment,en
Clearing power bill balance,electricity_payment,en
Handling electricity bill payment,electricity_payment,en
Taking care of power bill,electricity_payment,en
Settling electricity bill dues,electricity_payment,en
Paying power bill online,electricity_payment,en
Clearing electricity bill balance,electricity_payment,en
Handling power bill payment,electricity_payment,en
Pay electricity bill,electricity_payment,en
Pay for electricity,electricity_payment,en
Make payment for electricity,electricity_payment,en
payment for electricity bill,electricity_payment,en
Electricity bill payment,electricity_payment,en
Check electricity bill,electricity_payment,en
Check electricity dues,electricity_payment,en
Paying electricity bill through upi,electricity_payment,en
Settling power bill using upi,electricity_payment,en
Covering electricity dues from upi balance,electricity_payment,en
Clearing power bill balance fthrough upi account,electricity_payment,en
